<?xml version="1.0" encoding="UTF-8" ?>
<settings
		xmlns="http://www.salzburgresearch.at"
		xmlns:xsi="http://www.w3.org/2001/XMLSchema-instance"
		xsi:schemaLocation="http://www.salzburgresearch.at validator.xsd">
	<general
		settingName="GeneralAnalysis"
		pbfDataFolder="%user.home%\Documents\_d\vgi\data\world_2017_02_winter"
		readQuadtree="false"
		resultFolder="%user.home%\Documents\_d\vgi\results\"
		filterTimestamp="2020-01-01T00:00:00Z" />
		
	<filterTags>
		<includeTag key="landuse" value="winter_sports" />
		<includeTag key="piste:type" value="" />
		<includeTag key="aerialway" value="" />
	</filterTags>
	
	<!-- filterElementType: UNDEFINED, POINT, LINE, RELATION -->
	<!-- temporalResolution: eternity, century, decade, year, month, day -->
	<!-- findRelatedOperations e.g. OP_SPLIT_WAY, OP_MERGE_WAY; very time-consuming -->
	<!-- actionTimeBuffer: 1000*60*60*24=86400000=1 day ; 1000*60*60*12=43200000=12hours -->
	<analysis
		filterElementType="LINE"
		analysisStartDate="2004-01-01T00:00:00Z"
		analysisEndDate="2018-01-01T00:00:00Z"
		temporalResolution="month"
		findRelatedOperations="false"
		writeGeometryFiles="true"
		actionTimeBuffer="43200000">
		<featureType name="piste" geometryType="LineString">
			<includeTag key="piste:type" value="downhill" />
			<property key="piste:type" />
			<property key="name" />
			<property key="ref" />
			<property key="piste:difficulty" />
			<property key="lit" />
			<property key="piste:lit" />
			<property key="start_date" />
			<property key="ele" />
		</featureType>
		<featureType name="aerialway" geometryType="LineString">
			<includeTag key="aerialway" value="" />
			<excludeTag key="aerialway" value="goods" />
			<excludeTag key="aerialway" value="zip_line" />
			<excludeTag key="aerialway" value="canopy" />
			<property key="aerialway" />
			<property key="name" />
			<property key="aerialway:occupancy" />
			<property key="aerialway:capacity" />
			<property key="aerialway:duration" />
			<property key="aerialway:bubble" />
			<property key="aerialway:heating" />
			<property key="start_date" />
			<property key="ele" />
			<property key="usage" />
		</featureType>
		<featureType name="wintersports" geometryType="Polygon">
			<includeTag key="landuse" value="winter_sports" />
			<property key="landuse" />
			<property key="name" />
		</featureType>
		
		<analysisSubject name="VgiAnalysisActionPerType" />
		<analysisSubject name="VgiAnalysisActionPerFeatureType" />
		<analysisSubject name="VgiAnalysisBatchGeneral" />
		<analysisSubject name="VgiAnalysisTags">
			<analysisSetting key="tagKey" value="" />
		</analysisSubject>
		<!-- 
		<analysisSubject name="VgiAnalysisCountry" />
		<analysisSubject name="VgiAnalysisUserPerTags">
			<analysisSetting key="tagKey" value="" />
		</analysisSubject>
		<analysisSubject name="VgiAnalysisFeatureStability" />
		<analysisSubject name="VgiAnalysisOperationPerType" />
		<analysisSubject name="VgiAnalysisUserPerAction">
			<analysisSetting key="mergeActionTypes" value="false" />
		</analysisSubject>
		<analysisSubject name="VgiAnalysisBatchContributor" />
		<analysisSubject name="VgiAnalysisUserPerOperation">
			<analysisSetting key="mergeOperationTypes" value="false" />
		</analysisSubject>
		<analysisSubject name="VgiAnalysisActionDetails">
			<analysisSetting key="includeOperationDetails" value="true" />
		</analysisSubject>
		<analysisSubject name="VgiAnalysisHourOfDay" />-->
		<!-- <analysisSubject name="VgiAnalysisChangeDetection" />-->
		
		<actionDefinition name="AC_CREATE_POINT" actionType="CREATE" geometryType="POINT">
			<definitionRule operationType="OP_RECREATE_NODE" entryPoint="YES" />
			<definitionRule operationType="OP_CREATE_NODE" entryPoint="YES" />
			<definitionRule operationType="OP_ADD_TAG" entryPoint="IF_FEATURE_TYPE_ADDED" />
			<definitionRule operationType="OP_MODIFY_TAG_VALUE" entryPoint="IF_FEATURE_TYPE_ADDED" />
		</actionDefinition>
		<actionDefinition name="AC_CREATE_LINE" actionType="CREATE" geometryType="LINE">
			<definitionRule operationType="OP_RECREATE_WAY" entryPoint="YES" />
			<definitionRule operationType="OP_CREATE_WAY" entryPoint="YES" />
			<definitionRule operationType="OP_ADD_TAG" entryPoint="IF_FEATURE_TYPE_ADDED" />
			<definitionRule operationType="OP_MODIFY_TAG_VALUE" entryPoint="IF_FEATURE_TYPE_ADDED" />
			<definitionRule operationType="OP_ADD_NODE" entryPoint="NO" />
		</actionDefinition><!--
		<actionDefinition name="AC_CREATE_RELATION" actionType="CREATE" geometryType="RELATION">
			<definitionRule operationType="OP_RECREATE_RELATION" entryPoint="YES" />
			<definitionRule operationType="OP_CREATE_RELATION" entryPoint="YES" />
			<definitionRule operationType="OP_ADD_TAG" entryPoint="IF_FEATURE_TYPE_ADDED" />
			<definitionRule operationType="OP_MODIFY_TAG_VALUE" entryPoint="IF_FEATURE_TYPE_ADDED" />
			<definitionRule operationType="OP_ADD_MEMBER" entryPoint="NO" />
		</actionDefinition>-->
		<actionDefinition name="AC_DELETE_POINT" actionType="DELETE" geometryType="POINT">
			<definitionRule operationType="OP_DELETE_NODE" entryPoint="YES" />
			<definitionRule operationType="OP_REMOVE_TAG" entryPoint="IF_FEATURE_TYPE_REMOVED" />
			<definitionRule operationType="OP_MODIFY_TAG_VALUE" entryPoint="IF_FEATURE_TYPE_REMOVED" />
		</actionDefinition>
		<actionDefinition name="AC_DELETE_LINE" actionType="DELETE" geometryType="LINE">
			<definitionRule operationType="OP_DELETE_WAY" entryPoint="YES" />
			<definitionRule operationType="OP_REMOVE_TAG" entryPoint="IF_FEATURE_TYPE_REMOVED" />
			<definitionRule operationType="OP_MODIFY_TAG_VALUE" entryPoint="IF_FEATURE_TYPE_REMOVED" />
			<definitionRule operationType="OP_REMOVE_NODE" entryPoint="NO" />
		</actionDefinition><!--
		<actionDefinition name="AC_DELETE_RELATION" actionType="DELETE" geometryType="RELATION">
			<definitionRule operationType="OP_DELETE_RELATION" entryPoint="YES" />
			<definitionRule operationType="OP_REMOVE_TAG" entryPoint="IF_FEATURE_TYPE_REMOVED" />
			<definitionRule operationType="OP_MODIFY_TAG_VALUE" entryPoint="IF_FEATURE_TYPE_REMOVED" />
			<definitionRule operationType="OP_REMOVE_MEMBER" entryPoint="NO" />
		</actionDefinition>-->
		<actionDefinition name="AC_UPDATE_POINT" actionType="UPDATE" geometryType="POINT">
			<definitionRule operationType="OP_ADD_TAG" entryPoint="YES" />
			<definitionRule operationType="OP_MODIFY_TAG_VALUE" entryPoint="YES" />
			<definitionRule operationType="OP_REMOVE_TAG" entryPoint="YES" />
			<definitionRule operationType="OP_MODIFY_COORDINATE" entryPoint="YES" />
		</actionDefinition><!--
		<actionDefinition name="AC_SPLIT_MERGE_LINE" actionType="UPDATE" geometryType="LINE">
			<definitionRule operationType="OP_SPLIT_WAY" entryPoint="YES" />
			<definitionRule operationType="OP_MERGE_WAY" entryPoint="YES" />
			<definitionRule operationType="OP_CREATE_WAY" entryPoint="NO" />
			<definitionRule operationType="OP_ADD_TAG" entryPoint="NO" />
			<definitionRule operationType="OP_MODIFY_TAG_VALUE" entryPoint="NO" />
			<definitionRule operationType="OP_REMOVE_TAG" entryPoint="NO" />
			<definitionRule operationType="OP_REVERSE_WAY" entryPoint="NO" />
			<definitionRule operationType="OP_ADD_NODE" entryPoint="NO" />
			<definitionRule operationType="OP_REMOVE_NODE" entryPoint="NO" />
			<definitionRule operationType="OP_REORDER_NODE" entryPoint="NO" />
			<definitionRule operationType="OP_MODIFY_WAY_COORDINATE" entryPoint="NO" />
		</actionDefinition>-->
		<actionDefinition name="AC_UPDATE_LINE" actionType="UPDATE" geometryType="LINE">
			<definitionRule operationType="OP_SPLIT_WAY" entryPoint="YES" />
			<definitionRule operationType="OP_MERGE_WAY" entryPoint="YES" />
			<definitionRule operationType="OP_ADD_TAG" entryPoint="YES" />
			<definitionRule operationType="OP_MODIFY_TAG_VALUE" entryPoint="YES" />
			<definitionRule operationType="OP_REMOVE_TAG" entryPoint="YES" />
			<definitionRule operationType="OP_REVERSE_WAY" entryPoint="YES" />
			<definitionRule operationType="OP_ADD_NODE" entryPoint="YES" />
			<definitionRule operationType="OP_REMOVE_NODE" entryPoint="YES" />
			<definitionRule operationType="OP_REORDER_NODE" entryPoint="YES" />
			<definitionRule operationType="OP_MODIFY_WAY_COORDINATE" entryPoint="YES" />
		</actionDefinition><!--
		<actionDefinition name="AC_UPDATE_RELATION" actionType="UPDATE" geometryType="RELATION">
			<definitionRule operationType="OP_ADD_TAG" entryPoint="YES" />
			<definitionRule operationType="OP_MODIFY_TAG_VALUE" entryPoint="YES" />
			<definitionRule operationType="OP_REMOVE_TAG" entryPoint="YES" />
			<definitionRule operationType="OP_ADD_MEMBER" entryPoint="YES" />
			<definitionRule operationType="OP_REMOVE_MEMBER" entryPoint="YES" />
			<definitionRule operationType="OP_REORDER_MEMBER" entryPoint="YES" />
			<definitionRule operationType="OP_MODIFY_ROLE" entryPoint="YES" />
		</actionDefinition>-->
	</analysis>
	<filterPolygons>
		<polygon label="StMoritz" geometry="POLYGON((9.771 46.482, 9.771 46.551, 9.860 46.551, 9.860 46.482, 9.771 46.482))" />
	</filterPolygons>
</settings>